{
  "$schema": "https://json-schema.org/draft/2020-12/schema",
  "title": "E3 Reconciled",
  "description": "Saída de reconcile_account (*-3_reconciled.json). Campos obrigatórios alinhados a scripts/reconcile_transactions.py; transações preservam chaves extras dos bancos.",
  "type": "object",
  "required": [
    "banco",
    "tipo_conta",
    "moeda",
    "periodo_cobertura",
    "saldo_inicial",
    "saldo_inicial_unknown",
    "saldo_final",
    "saldo_final_unknown",
    "fontes",
    "transacoes_total",
    "transacoes_duplicadas_removidas",
    "transacoes"
  ],
  "properties": {
    "banco": {
      "type": "string",
      "minLength": 1
    },
    "tipo_conta": {
      "type": "string",
      "minLength": 1
    },
    "titular": {
      "type": [
        "string",
        "null"
      ],
      "description": "DEPRECATED (ADR-226 PR2) — use `titulares`. Mantido por compat."
    },
    "titulares": {
      "type": "array",
      "items": {
        "type": "string"
      },
      "description": "ADR-226 PR2 — lista de titulares; conta conjunta tem 2+."
    },
    "account_number": {
      "type": [
        "string",
        "null"
      ],
      "description": "ADR-226 PR2 — account_number normalizado (digits-only) do extrato."
    },
    "moeda": {
      "type": "string",
      "minLength": 1
    },
    "periodo_cobertura": {
      "type": "object",
      "required": [
        "inicio",
        "fim"
      ],
      "properties": {
        "inicio": {
          "type": "string",
          "minLength": 1
        },
        "fim": {
          "type": "string",
          "minLength": 1
        }
      },
      "additionalProperties": true
    },
    "saldo_inicial": {
      "type": "number"
    },
    "saldo_inicial_unknown": {
      "type": "boolean"
    },
    "saldo_final": {
      "type": "number"
    },
    "saldo_final_unknown": {
      "type": "boolean"
    },
    "fontes": {
      "type": "array",
      "items": {
        "type": "string"
      }
    },
    "transacoes_total": {
      "type": "integer",
      "minimum": 0
    },
    "transacoes_duplicadas_removidas": {
      "type": "integer",
      "minimum": 0
    },
    "transacoes": {
      "type": "array",
      "items": {
        "type": "object",
        "additionalProperties": true,
        "properties": {
          "valor": {
            "type": "number",
            "description": "Valor da transação como NUMBER (nunca string). O invariante que faz o parse monetário do E4 ser no-op vive aqui, onde é consumido (review data-engineer do PR #1417)."
          }
        }
      }
    },
    "tx_carregadas": {
      "type": "integer",
      "minimum": 0,
      "description": "ADR-347 — âncora de contagem (pós-period-norm, PRÉ-anachronic/undated). Aditivo-opcional (PR1); required no flip HARD (PR3)."
    },
    "remocoes": {
      "type": "object",
      "description": "ADR-347 — partição de remoções de tx por canal (ledger de conservação de contagem). Aditivo-opcional (PR1). Fecha tx_carregadas == transacoes_total + Σ remocoes[*].count.",
      "properties": {
        "undated_drop": {
          "$ref": "#/$defs/remocao"
        },
        "anachronic": {
          "$ref": "#/$defs/remocao"
        },
        "intra_statement_dedup": {
          "$ref": "#/$defs/remocao"
        },
        "cross_file_dedup": {
          "$ref": "#/$defs/remocao"
        },
        "cross_document_collapse": {
          "$ref": "#/$defs/remocao_com_meses"
        }
      },
      "additionalProperties": false
    }
  },
  "additionalProperties": true,
  "$defs": {
    "remocao": {
      "type": "object",
      "required": [
        "count",
        "valor_cents"
      ],
      "properties": {
        "count": {
          "type": "integer",
          "minimum": 0
        },
        "valor_cents": {
          "type": "integer"
        }
      },
      "additionalProperties": false
    },
    "remocao_com_meses": {
      "description": "Canal cross_document_collapse (A40.l2 PR3c1): `remocao` + breakdown mensal. `$def` próprio em vez de allOf sobre `remocao` porque `additionalProperties:false` do $ref rejeitaria a propriedade nova; e próprio em vez de estender `remocao` porque os outros 4 canais NÃO carregam mês — declarar lá convidaria o próximo a preencher.",
      "type": "object",
      "required": [
        "count",
        "valor_cents"
      ],
      "properties": {
        "count": {
          "type": "integer",
          "minimum": 0
        },
        "valor_cents": {
          "type": "integer"
        },
        "meses": {
          "description": "Lista ordenada, NUNCA escalar nem mapa: is_monetary('meses') é True em dev/golden_diff.py, então escalar viraria ×100 e num mapa o mês seria a chave. Como lista, o leaf `mes` é string. Omitida quando não houve colapso.",
          "type": "array",
          "items": {
            "type": "object",
            "required": [
              "mes",
              "count"
            ],
            "properties": {
              "mes": {
                "type": "string",
                "pattern": "^[0-9]{4}-[0-9]{2}$"
              },
              "count": {
                "type": "integer",
                "minimum": 0
              }
            },
            "additionalProperties": false
          }
        }
      },
      "additionalProperties": false
    }
  }
}
