{
  "banco": "c6bank",
  "tipo_conta": "extratoconta",
  "titular": null,
  "moeda": "EUR",
  "periodo_cobertura": {
    "inicio": "",
    "fim": ""
  },
  "saldo_inicial": 0,
  "saldo_inicial_unknown": true,
  "saldo_final": 0,
  "saldo_final_unknown": true,
  "fontes": [
    "c6bank_extratocontaglobaleur_202511_202512-2_extract.json",
    "c6bank_extratocontaglobaleur_202601_202603-2_extract.json",
    "c6bank_extratocontaglobaleur_202601_202604-2_extract.json"
  ],
  "transacoes_total": 9,
  "transacoes_duplicadas_removidas": 1,
  "transacoes": [
    {
      "data": "2026-02-07",
      "descricao": "Transf C6 Conta Global Líquido",
      "tipo": "crédito",
      "valor": 500.0,
      "saldo_apos": 0.0
    },
    {
      "data": "2026-02-10",
      "tipo": "débito",
      "descricao": "GOOGLE FI COBRANCA",
      "valor": 8.5,
      "saldo_apos": -8.5
    },
    {
      "data": "2026-02-13",
      "descricao": "Transf C6 Conta Global Líquido",
      "tipo": "crédito",
      "valor": 350.0,
      "saldo_apos": 0.0
    },
    {
      "data": "2026-02-15",
      "descricao": "Transf C6 Conta Global Líquido",
      "tipo": "crédito",
      "valor": 150.0,
      "saldo_apos": 0.0
    },
    {
      "data": "2026-02-18",
      "descricao": "Débito de cartão - Areas Portugal Sa\\aeroporto Frtmaia\\447 Cartão 0205",
      "tipo": "débito",
      "valor": 4.05,
      "saldo_apos": 0.0
    },
    {
      "data": "2026-02-21",
      "descricao": "Débito de cartão - Audasa Visa\\alfredo Vicentinha Coruna\\150 Cartão 0205",
      "tipo": "débito",
      "valor": 3.55,
      "saldo_apos": 0.0
    },
    {
      "data": "2026-02-21",
      "descricao": "Débito de cartão - Audasa Visa\\alfredo Vicentinha Coruna\\150 Cartão 0205",
      "tipo": "débito",
      "valor": 5.05,
      "saldo_apos": 0.0
    },
    {
      "data": "2026-02-21",
      "descricao": "Débito de cartão - Audasa Visa\\alfredo Vicentinha Coruna\\150 Cartão 0205",
      "tipo": "débito",
      "valor": 7.55,
      "saldo_apos": 0.0
    },
    {
      "data": "2026-02-25",
      "tipo": "débito",
      "descricao": "GOOGLE FI COBRANCA",
      "valor": 9.25,
      "saldo_apos": -17.75
    }
  ]
}