{
  "banco": "Bank of America",
  "tipo_conta": "extratoconta",
  "titular": null,
  "moeda": "BRL",
  "periodo_cobertura": {
    "inicio": "",
    "fim": ""
  },
  "saldo_inicial": 0,
  "saldo_inicial_unknown": true,
  "saldo_final": 0,
  "saldo_final_unknown": true,
  "fontes": [
    "bankofamerica_extratoconta_202602_202603-2_extract.json"
  ],
  "transacoes_total": 0,
  "transacoes_duplicadas_removidas": 0,
  "transacoes": []
}