{
  "banco": "itau",
  "tipo_conta": "faturapaoacucar",
  "titular": null,
  "moeda": "BRL",
  "periodo_cobertura": {
    "inicio": "2025-05-01",
    "fim": "2026-03-31"
  },
  "saldo_inicial": 0,
  "saldo_inicial_unknown": true,
  "saldo_final": 0,
  "saldo_final_unknown": true,
  "fontes": [
    "itau_faturapaoacucar_202505-2_extract.json",
    "itau_faturapaoacucar_202506-2_extract.json",
    "itau_faturapaoacucar_202507-2_extract.json",
    "itau_faturapaoacucar_202508-2_extract.json",
    "itau_faturapaoacucar_202509-2_extract.json",
    "itau_faturapaoacucar_202510-2_extract.json",
    "itau_faturapaoacucar_202511-2_extract.json",
    "itau_faturapaoacucar_202512-2_extract.json",
    "itau_faturapaoacucar_202601-2_extract.json",
    "itau_faturapaoacucar_202602-2_extract.json",
    "itau_faturapaoacucar_202603-2_extract.json"
  ],
  "transacoes_total": 20,
  "transacoes_duplicadas_removidas": 6,
  "transacoes": [
    {
      "data": "2025-06-07",
      "descricao": "Brasilp*BrasilPara11/12",
      "valor": -59.0,
      "cartao": "titular"
    },
    {
      "data": "2025-06-07",
      "descricao": "Brasilp*BrasilPara12/12",
      "valor": -59.0,
      "cartao": "titular"
    },
    {
      "data": "2025-06-08",
      "descricao": "BRASIL PARAL*Bras 01/12",
      "valor": -59.0,
      "cartao": "titular"
    },
    {
      "data": "2025-06-08",
      "descricao": "BRASIL PARAL*Bras 02/12",
      "valor": -59.0,
      "cartao": "titular"
    },
    {
      "data": "2025-06-08",
      "descricao": "BRASIL PARAL*Bras 03/12",
      "valor": -59.0,
      "cartao": "titular"
    },
    {
      "data": "2025-06-08",
      "descricao": "BRASIL PARAL*Bras 04/12",
      "valor": -59.0,
      "cartao": "titular"
    },
    {
      "data": "2025-06-08",
      "descricao": "BRASIL PARAL*Bras 05/12",
      "valor": -59.0,
      "cartao": "titular"
    },
    {
      "data": "2025-06-08",
      "descricao": "BRASIL PARAL*Bras 06/12",
      "valor": -59.0,
      "cartao": "titular"
    },
    {
      "data": "2025-06-08",
      "descricao": "BRASIL PARAL*Bras 07/12",
      "valor": -59.0,
      "cartao": "titular"
    },
    {
      "data": "2025-06-19",
      "descricao": "SQSP* INV186737595",
      "valor": -92.32,
      "cartao": "titular"
    },
    {
      "data": "2025-08-04",
      "descricao": "EBN *AMAZON RETAIL",
      "valor": -132.41,
      "cartao": "titular"
    },
    {
      "data": "2025-08-07",
      "descricao": "AMAZON RETA* Y76ZD1FJ3",
      "valor": -224.07,
      "cartao": "titular"
    },
    {
      "data": "2025-08-08",
      "descricao": "AMAZON MKTPL*JF2978P03",
      "valor": -210.11,
      "cartao": "titular"
    },
    {
      "data": "2025-09-06",
      "descricao": "AMAZON MKTPL*BJ8I19AQ3",
      "valor": -96.04,
      "cartao": "titular"
    },
    {
      "data": "2025-09-06",
      "descricao": "AMAZON MKTPL*A510Y5UY3",
      "valor": -894.84,
      "cartao": "titular"
    },
    {
      "data": "2026-01-15",
      "descricao": "SQSP* DOMAIN#218016570",
      "valor": -191.8,
      "cartao": "titular"
    },
    {
      "data": "2026-06-08",
      "descricao": "BRASIL PARAL*Bras 07/12",
      "valor": -59.0,
      "cartao": "titular"
    },
    {
      "data": "2026-06-08",
      "descricao": "BRASIL PARAL*Bras 08/12",
      "valor": -59.0,
      "cartao": "titular"
    },
    {
      "data": "2026-06-08",
      "descricao": "BRASIL PARAL*Bras 09/12",
      "valor": -59.0,
      "cartao": "titular"
    },
    {
      "data": "2026-06-08",
      "descricao": "BRASIL PARAL*Bras 10/12",
      "valor": -59.0,
      "cartao": "titular"
    }
  ]
}