{
  "banco": "c6bank",
  "tipo_conta": "extratoconta",
  "titular": null,
  "moeda": "USD",
  "periodo_cobertura": {
    "inicio": "",
    "fim": ""
  },
  "saldo_inicial": 0,
  "saldo_inicial_unknown": true,
  "saldo_final": 0,
  "saldo_final_unknown": true,
  "fontes": [
    "c6bank_extratocontaglobalusd_202505_202507-2_extract.json",
    "c6bank_extratocontaglobalusd_202508_202510-2_extract.json",
    "c6bank_extratocontaglobalusd_202511_202512-2_extract.json",
    "c6bank_extratocontaglobalusd_202512_202603-2_extract.json",
    "c6bank_extratocontaglobalusd_202601_202604-2_extract.json"
  ],
  "transacoes_total": 21,
  "transacoes_duplicadas_removidas": 0,
  "transacoes": [
    {
      "data": "2025-05-10",
      "tipo": "débito",
      "descricao": "WALMART SUPERMERCADO",
      "valor": 85.32,
      "saldo_apos": -85.32
    },
    {
      "data": "2025-05-12",
      "tipo": "débito",
      "descricao": "TARGET LOJA",
      "valor": 124.56,
      "saldo_apos": -209.88
    },
    {
      "data": "2025-05-15",
      "tipo": "débito",
      "descricao": "AMAZON COMPRA",
      "valor": 67.89,
      "saldo_apos": -277.77
    },
    {
      "data": "2025-06-02",
      "tipo": "débito",
      "descricao": "DISNEY RESORT",
      "valor": 450.0,
      "saldo_apos": -727.77
    },
    {
      "data": "2025-06-05",
      "tipo": "débito",
      "descricao": "WALMART SUPERMERCADO",
      "valor": 95.41,
      "saldo_apos": -823.18
    },
    {
      "data": "2025-06-18",
      "tipo": "débito",
      "descricao": "TARGET LOJA",
      "valor": 156.23,
      "saldo_apos": -979.41
    },
    {
      "data": "2025-07-01",
      "tipo": "débito",
      "descricao": "BOUTIQUE MIAMI",
      "valor": 234.5,
      "saldo_apos": -1213.91
    },
    {
      "data": "2025-07-10",
      "tipo": "débito",
      "descricao": "RESTAURANTE ORLANDO",
      "valor": 125.0,
      "saldo_apos": -1338.91
    },
    {
      "data": "2025-08-05",
      "tipo": "débito",
      "descricao": "RESORT FLORIDA",
      "valor": 520.0,
      "saldo_apos": -520.0
    },
    {
      "data": "2025-08-12",
      "tipo": "débito",
      "descricao": "THEME PARK ORLANDO",
      "valor": 315.0,
      "saldo_apos": -835.0
    },
    {
      "data": "2025-09-08",
      "tipo": "débito",
      "descricao": "WALMART SUPERMERCADO",
      "valor": 78.45,
      "saldo_apos": -913.45
    },
    {
      "data": "2025-10-15",
      "tipo": "débito",
      "descricao": "AMAZON COMPRA",
      "valor": 45.67,
      "saldo_apos": -959.12
    },
    {
      "data": "2025-11-21",
      "tipo": "débito",
      "descricao": "TRANSFERENCIA INTERNACIONAL",
      "valor": 3840.0,
      "saldo_apos": -3840.0
    },
    {
      "data": "2026-01-10",
      "tipo": "débito",
      "descricao": "GOOGLE FI COBRANCA",
      "valor": 125.0,
      "saldo_apos": -125.0
    },
    {
      "data": "2026-01-17",
      "descricao": "Débito de cartão - Google \"i Xt4b1w\\1600 Amphitheatre Pkwy Cartão 8884",
      "tipo": "débito",
      "valor": 25.34,
      "saldo_apos": 0.0
    },
    {
      "data": "2026-02-15",
      "tipo": "débito",
      "descricao": "GOOGLE FI COBRANCA",
      "valor": 128.5,
      "saldo_apos": -253.5
    },
    {
      "data": "2026-02-17",
      "descricao": "Débito de cartão - Google \"i Vzhop\\1600 Amphitheatre Pkwy Cartão 8884",
      "tipo": "débito",
      "valor": 25.66,
      "saldo_apos": 0.0
    },
    {
      "data": "2026-03-12",
      "tipo": "débito",
      "descricao": "GOOGLE FI COBRANCA",
      "valor": 130.0,
      "saldo_apos": -383.5
    },
    {
      "data": "2026-03-15",
      "descricao": "Transf C6 Conta Global Líquido",
      "tipo": "crédito",
      "valor": 100.0,
      "saldo_apos": 0.0
    },
    {
      "data": "2026-03-17",
      "descricao": "Débito de cartão - Google \"i 6765psbl\\1600 Amphitheatre Pkwy Cartão 8884",
      "tipo": "débito",
      "valor": 25.34,
      "saldo_apos": 0.0
    },
    {
      "data": "2026-04-05",
      "tipo": "débito",
      "descricao": "GOOGLE FI COBRANCA",
      "valor": 125.0,
      "saldo_apos": -508.5
    }
  ]
}