{
  "banco": "Itaú",
  "tipo_conta": "faturapaoacucar",
  "titular": "DAVID ROBERT CAMARGO DE CAMPOS",
  "moeda": "BRL",
  "periodo_cobertura": {
    "inicio": "2025-06-07",
    "fim": "2025-08-06"
  },
  "saldo_inicial": 0,
  "saldo_inicial_unknown": true,
  "saldo_final": 0,
  "saldo_final_unknown": true,
  "fontes": [
    "itau_faturapaoacucar_202505-2_extract.json",
    "itau_faturapaoacucar_202506-2_extract.json",
    "itau_faturapaoacucar_202507-2_extract.json",
    "itau_faturapaoacucar_202508-2_extract.json",
    "itau_faturapaoacucar_202509-2_extract.json",
    "itau_faturapaoacucar_202510-2_extract.json",
    "itau_faturapaoacucar_202511-2_extract.json",
    "itau_faturapaoacucar_202512-2_extract.json",
    "itau_faturapaoacucar_202601-2_extract.json",
    "itau_faturapaoacucar_202602-2_extract.json",
    "itau_faturapaoacucar_202603-2_extract.json"
  ],
  "transacoes_total": 31,
  "transacoes_duplicadas_removidas": 0,
  "transacoes": [
    {
      "data": "2025-06-07",
      "descricao": "Brasilp*BrasilPara11/12",
      "valor": 59.0,
      "cartao": "DAVID R C DE CAMPOS (final 4984)",
      "parcela": "1/12"
    },
    {
      "data": "2025-06-07",
      "descricao": "Brasilp*BrasilPara12/12",
      "valor": 59.0,
      "cartao": "DAVID R C DE CAMPOS (final 4984)",
      "parcela": "2/12"
    },
    {
      "data": "2025-06-08",
      "descricao": "BRASIL PARAL*Bras 01/12",
      "valor": 59.0,
      "cartao": "DAVID R C DE CAMPOS (final 4984)"
    },
    {
      "data": "2025-06-08",
      "descricao": "BRASIL PARAL*Bras 02/12",
      "valor": 59.0,
      "cartao": "DAVID R C DE CAMPOS (final 4984)",
      "parcela": "2/12"
    },
    {
      "data": "2025-06-08",
      "descricao": "BRASIL PARAL*Bras 03/12",
      "valor": 59.0,
      "cartao": "DAVID R C DE CAMPOS (final 4984)",
      "parcela": "3/12"
    },
    {
      "data": "2025-06-19",
      "descricao": "SQSP* INV186737595",
      "valor": 92.32,
      "cartao": "DAVID R C DE CAMPOS (final 4984)",
      "forex": {
        "moeda_original": "USD",
        "valor_original": 87.0,
        "cotacao": 5.81
      }
    },
    {
      "data": "2025-06-19",
      "descricao": "Repasse de IOF",
      "valor": 3.25,
      "cartao": "DAVID R C DE CAMPOS (final 4984)",
      "tipo_lancamento": "iof"
    },
    {
      "data": "2025-08-04",
      "descricao": "EBN *AMAZON RETAIL",
      "valor": 132.41,
      "cartao": "DAVID R C DE CAMPOS (final 4984)"
    },
    {
      "data": "2025-08-06",
      "descricao": "BRASIL PARAL*Bras 04/12",
      "valor": 59.0,
      "cartao": "DAVID R C DE CAMPOS (final 4984)",
      "parcela": "4/12"
    },
    {
      "data": "2025-08-06",
      "descricao": "BRASIL PARAL*Bras 05/12",
      "valor": 59.0,
      "cartao": "DAVID R C DE CAMPOS (final 4984)",
      "parcela": "5/12"
    },
    {
      "data": "2025-08-06",
      "descricao": "BRASIL PARAL*Bras 06/12",
      "valor": 59.0,
      "cartao": "DAVID R C DE CAMPOS (final 4984)",
      "parcela": "6/12"
    },
    {
      "data": "2025-08-06",
      "descricao": "BRASIL PARAL*Bras 07/12",
      "valor": 59.0,
      "cartao": "DAVID R C DE CAMPOS (final 4984)",
      "parcela": "7/12"
    },
    {
      "data": "2025-08-06",
      "descricao": "BRASIL PARAL*Bras 08/12",
      "valor": 59.0,
      "cartao": "DAVID R C DE CAMPOS (final 4984)",
      "parcela": "8/12"
    },
    {
      "data": "2025-08-06",
      "descricao": "BRASIL PARAL*Bras 09/12",
      "valor": 59.0,
      "cartao": "DAVID R C DE CAMPOS (final 4984)",
      "parcela": "9/12"
    },
    {
      "data": "2025-08-07",
      "descricao": "AMAZON RETA* Y76ZD1FJ3",
      "valor": 224.07,
      "cartao": "DAVID R C DE CAMPOS (final 4984)",
      "forex": {
        "moeda_original": "USD",
        "valor_original": 38.7,
        "cotacao": 5.79
      }
    },
    {
      "data": "2025-08-08",
      "descricao": "AMAZON MKTPL*JF2978P03",
      "valor": 210.11,
      "cartao": "DAVID R C DE CAMPOS (final 4984)",
      "forex": {
        "moeda_original": "USD",
        "valor_original": 36.54,
        "cotacao": 5.75
      }
    },
    {
      "data": "2025-08-08",
      "descricao": "Repasse de IOF",
      "valor": 56.85,
      "cartao": "DAVID R C DE CAMPOS (final 4984)",
      "tipo_lancamento": "iof"
    },
    {
      "data": "2025-08-25",
      "descricao": "AMAZON RETA* 8Y9WW7DJ3",
      "valor": 270.97,
      "cartao": "DAVID R C DE CAMPOS (final 4984)",
      "forex": {
        "moeda_original": "USD",
        "valor_original": 47.29,
        "cotacao": 5.73
      }
    },
    {
      "data": "2025-08-27",
      "descricao": "AMAZON RETA* YK9XM77E3",
      "valor": 201.66,
      "cartao": "DAVID R C DE CAMPOS (final 4984)",
      "forex": {
        "moeda_original": "USD",
        "valor_original": 34.95,
        "cotacao": 5.77
      }
    },
    {
      "data": "2025-08-27",
      "descricao": "AMAZON RETA* NS9LS8KK3",
      "valor": 317.06,
      "cartao": "DAVID R C DE CAMPOS (final 4984)",
      "forex": {
        "moeda_original": "USD",
        "valor_original": 54.95,
        "cotacao": 5.77
      }
    },
    {
      "data": "2025-08-28",
      "descricao": "AMAZON MKTPL*761GA95A3",
      "valor": 400.3,
      "cartao": "DAVID R C DE CAMPOS (final 4984)",
      "forex": {
        "moeda_original": "USD",
        "valor_original": 69.86,
        "cotacao": 5.73
      }
    },
    {
      "data": "2025-08-30",
      "descricao": "AMAZON RETA* RK4N12ZW3",
      "valor": 112.91,
      "cartao": "DAVID R C DE CAMPOS (final 4984)",
      "forex": {
        "moeda_original": "USD",
        "valor_original": 19.67,
        "cotacao": 5.74
      }
    },
    {
      "data": "2025-09-06",
      "descricao": "AMAZON MKTPL*BJ8I19AQ3",
      "valor": 96.04,
      "cartao": "DAVID R C DE CAMPOS (final 4984)",
      "forex": {
        "moeda_original": "USD",
        "valor_original": 16.79,
        "cotacao": 5.72
      }
    },
    {
      "data": "2025-09-06",
      "descricao": "AMAZON MKTPL*A510Y5UY3",
      "valor": 894.84,
      "cartao": "DAVID R C DE CAMPOS (final 4984)",
      "forex": {
        "moeda_original": "USD",
        "valor_original": 156.44,
        "cotacao": 5.72
      }
    },
    {
      "data": "2025-09-20",
      "descricao": "AMAZON MKTPLACE PMTS",
      "valor": -90.86,
      "cartao": "DAVID R C DE CAMPOS (final 4984)",
      "forex": {
        "moeda_original": "USD",
        "valor_original": -16.11,
        "cotacao": 5.64
      }
    },
    {
      "data": "2025-09-21",
      "descricao": "ESTORNO CUSTO DE IOF",
      "valor": -3.16,
      "cartao": "DAVID R C DE CAMPOS (final 4984)",
      "tipo_lancamento": "iof"
    },
    {
      "data": "2025-09-22",
      "descricao": "AMAZON MKTPLACE PMTS",
      "valor": -396.11,
      "cartao": "DAVID R C DE CAMPOS (final 4984)",
      "forex": {
        "moeda_original": "USD",
        "valor_original": -69.86,
        "cotacao": 5.67
      }
    },
    {
      "data": "2025-09-23",
      "descricao": "ESTORNO CUSTO DE IOF",
      "valor": -13.89,
      "cartao": "DAVID R C DE CAMPOS (final 4984)",
      "tipo_lancamento": "iof"
    },
    {
      "data": "2025-09-30",
      "descricao": "Repasse de IOF",
      "valor": 38.68,
      "cartao": "DAVID R C DE CAMPOS (final 4984)",
      "tipo_lancamento": "iof"
    },
    {
      "data": "2026-01-15",
      "descricao": "SQSP* DOMAIN#218016570",
      "valor": 191.8,
      "cartao": "DAVID R C DE CAMPOS (final 4984)",
      "forex": {
        "moeda_original": "USD",
        "valor_original": 180.0,
        "cotacao": 5.71
      }
    },
    {
      "data": "2026-01-15",
      "descricao": "Repasse de IOF",
      "valor": 6.74,
      "cartao": "DAVID R C DE CAMPOS (final 4984)",
      "tipo_lancamento": "iof"
    }
  ]
}