{
  "banco": "Rico",
  "tipo_conta": "extratoconta",
  "titular": null,
  "moeda": "BRL",
  "periodo_cobertura": {
    "inicio": "2025-09-30",
    "fim": "2026-03-29"
  },
  "saldo_inicial": 0,
  "saldo_inicial_unknown": true,
  "saldo_final": 17186.4,
  "saldo_final_unknown": false,
  "fontes": [
    "rico_extratoconta_202510_202603-2_extract.json"
  ],
  "transacoes_total": 2,
  "transacoes_duplicadas_removidas": 0,
  "transacoes": [
    {
      "data": "2026-03-20",
      "descricao": "JUROS S/ CAPITAL DE CLIENTES PETR4 S/",
      "valor": 253.13,
      "saldo_apos": 17186.4,
      "tipo": "credito"
    },
    {
      "data": "2026-03-20",
      "descricao": "RENDIMENTOS DE CLIENTES PETR4 S/",
      "valor": 6.97,
      "saldo_apos": 16933.27,
      "tipo": "credito"
    }
  ]
}