{
  "banco": "rico",
  "tipo_conta": "extratoconta",
  "titular": null,
  "moeda": "BRL",
  "periodo_cobertura": {
    "inicio": "2025-10-01",
    "fim": "2026-03-31"
  },
  "saldo_inicial": 0,
  "saldo_inicial_unknown": true,
  "saldo_final": 0,
  "saldo_final_unknown": true,
  "fontes": [
    "rico_extratoconta_202510_202603-2_extract.json"
  ],
  "transacoes_total": 0,
  "transacoes_duplicadas_removidas": 0,
  "transacoes": []
}