{
  "banco": "Santander",
  "tipo_conta": "extratoconta",
  "titular": null,
  "moeda": "BRL",
  "periodo_cobertura": {
    "inicio": "2025-11-01",
    "fim": "2026-03-30"
  },
  "saldo_inicial": 0.0,
  "saldo_inicial_unknown": false,
  "saldo_final": 280.6,
  "saldo_final_unknown": false,
  "fontes": [
    "santander_extratoconta_202511_202512-2_extract.json",
    "santander_extratoconta_202601_202603-2_extract.json"
  ],
  "transacoes_total": 21,
  "transacoes_duplicadas_removidas": 0,
  "transacoes": [
    {
      "data": "2026-01-02",
      "descricao": "IOF IMPOSTO OPERACOES FINANCEIRAS PERIODO: 01/12 A 31/12/25",
      "valor": -7.99,
      "saldo_apos": -3302.0,
      "tipo": "debito"
    },
    {
      "data": "2026-01-05",
      "descricao": "JUROS SALDO UTILIZ ATE LIMITE PERIODO: 03/12 A 02/01/26",
      "valor": -263.75,
      "saldo_apos": -3567.88,
      "tipo": "debito"
    },
    {
      "data": "2026-01-06",
      "descricao": "DEBITO AUT. TELEFONE CELULAR VIVO MOVEL-SP",
      "valor": -338.0,
      "saldo_apos": -3905.88,
      "tipo": "debito"
    },
    {
      "data": "2026-01-15",
      "descricao": "DEBITO AUT. FAT.CARTAO MASTER CARD FINAL 2506",
      "valor": -372.85,
      "saldo_apos": -4278.73,
      "tipo": "debito"
    },
    {
      "data": "2026-01-27",
      "descricao": "MENSALIDADE DE SEGURO Parc 007/012 AP 749936",
      "valor": -10.07,
      "saldo_apos": -4288.8,
      "tipo": "debito"
    },
    {
      "data": "2026-02-02",
      "descricao": "IOF IMPOSTO OPERACOES FINANCEIRAS PERIODO: 01/01 A 31/01/26",
      "valor": -10.22,
      "saldo_apos": -4299.02,
      "tipo": "debito"
    },
    {
      "data": "2026-02-02",
      "descricao": "IOF ADICIONAL - AUTOMATICO PERIODO: 01/01 A 31/01/26",
      "valor": -3.75,
      "saldo_apos": -4302.77,
      "tipo": "debito"
    },
    {
      "data": "2026-02-03",
      "descricao": "JUROS SALDO UTILIZ ATE LIMITE PERIODO: 03/01 A 02/02/26",
      "valor": -340.89,
      "saldo_apos": -4643.66,
      "tipo": "debito"
    },
    {
      "data": "2026-02-04",
      "descricao": "PIX RECEBIDO DOUGLAS CAMARGO DE CAMPOS",
      "valor": 100.0,
      "saldo_apos": -4543.66,
      "tipo": "credito"
    },
    {
      "data": "2026-02-06",
      "descricao": "PIX RECEBIDO DAVID ROBERT CAMARGO DE C",
      "valor": 5000.0,
      "saldo_apos": 118.34,
      "tipo": "credito"
    },
    {
      "data": "2026-02-06",
      "descricao": "DEBITO AUT. TELEFONE CELULAR VIVO MOVEL-SP",
      "valor": -338.0,
      "saldo_apos": -4881.66,
      "tipo": "debito"
    },
    {
      "data": "2026-02-18",
      "descricao": "DEBITO AUT. FAT.CARTAO MASTER CARD FINAL 2506",
      "valor": -122.43,
      "saldo_apos": -4.09,
      "tipo": "debito"
    },
    {
      "data": "2026-02-27",
      "descricao": "MENSALIDADE DE SEGURO Parc 008/012 AP 749936",
      "valor": -10.07,
      "saldo_apos": -14.16,
      "tipo": "debito"
    },
    {
      "data": "2026-03-02",
      "descricao": "IOF IMPOSTO OPERACOES FINANCEIRAS PERIODO: 01/02 A 28/02/26",
      "valor": -1.83,
      "saldo_apos": -15.99,
      "tipo": "debito"
    },
    {
      "data": "2026-03-02",
      "descricao": "IOF ADICIONAL - AUTOMATICO PERIODO: 01/02 A 28/02/26",
      "valor": -1.38,
      "saldo_apos": -17.37,
      "tipo": "debito"
    },
    {
      "data": "2026-03-03",
      "descricao": "JUROS SALDO UTILIZ ATE LIMITE PERIODO: 03/02 A 02/03/26",
      "valor": -57.21,
      "saldo_apos": -74.58,
      "tipo": "debito"
    },
    {
      "data": "2026-03-04",
      "descricao": "PIX RECEBIDO DOUGLAS CAMARGO DE CAMPOS",
      "valor": 100.0,
      "saldo_apos": 25.42,
      "tipo": "credito"
    },
    {
      "data": "2026-03-09",
      "descricao": "DEBITO AUT. TELEFONE CELULAR VIVO MOVEL-SP",
      "valor": -351.93,
      "saldo_apos": -326.51,
      "tipo": "debito"
    },
    {
      "data": "2026-03-16",
      "descricao": "DEBITO AUT. FAT.CARTAO MASTER CARD FINAL 2506",
      "valor": -382.82,
      "saldo_apos": -709.33,
      "tipo": "debito"
    },
    {
      "data": "2026-03-27",
      "descricao": "MENSALIDADE DE SEGURO Parc 009/012 AP 749936",
      "valor": -10.07,
      "saldo_apos": -719.4,
      "tipo": "debito"
    },
    {
      "data": "2026-03-30",
      "descricao": "PIX RECEBIDO DAVID ROBERT CAMARGO FERR",
      "valor": 1000.0,
      "saldo_apos": 280.6,
      "tipo": "credito"
    }
  ]
}