{
  "banco": "Wise",
  "tipo_conta": "extratoconta",
  "titular": null,
  "moeda": "BRL",
  "periodo_cobertura": {
    "inicio": "",
    "fim": ""
  },
  "saldo_inicial": 0,
  "saldo_inicial_unknown": true,
  "saldo_final": 0,
  "saldo_final_unknown": true,
  "fontes": [
    "wise_extratocontausd_202501_202603-2_extract.json"
  ],
  "transacoes_total": 31,
  "transacoes_duplicadas_removidas": 0,
  "transacoes": [
    {
      "data": "2025-04-21",
      "descricao": "Dinheiro adicionado à conta",
      "tipo": "crédito",
      "valor": 100.0,
      "saldo_apos": 100.0
    },
    {
      "data": "2025-04-22",
      "descricao": "Pago para IU65 Premium & B",
      "tipo": "débito",
      "valor": 94.39,
      "saldo_apos": 5.61
    },
    {
      "data": "2025-04-27",
      "descricao": "Dinheiro adicionado à conta",
      "tipo": "crédito",
      "valor": 100.0,
      "saldo_apos": 105.61
    },
    {
      "data": "2025-05-02",
      "descricao": "Pago para IU65 Premium & B",
      "tipo": "débito",
      "valor": 94.39,
      "saldo_apos": 11.22
    },
    {
      "data": "2025-05-18",
      "descricao": "Recebeu dinheiro de Douglas Camargo De Campos",
      "tipo": "crédito",
      "valor": 100.0,
      "saldo_apos": 111.22
    },
    {
      "data": "2025-05-19",
      "descricao": "Recebeu dinheiro de Douglas Camargo De Campos",
      "tipo": "crédito",
      "valor": 1390.0,
      "saldo_apos": 1501.22
    },
    {
      "data": "2025-05-25",
      "descricao": "Dinheiro adicionado à conta",
      "tipo": "crédito",
      "valor": 1900.0,
      "saldo_apos": 3401.22
    },
    {
      "data": "2025-05-28",
      "descricao": "Pago para Anderson Univers",
      "tipo": "débito",
      "valor": 2940.0,
      "saldo_apos": 461.22
    },
    {
      "data": "2025-05-30",
      "descricao": "Dinheiro adicionado à conta",
      "tipo": "crédito",
      "valor": 500.0,
      "saldo_apos": 961.22
    },
    {
      "data": "2025-06-02",
      "descricao": "Pago para IU65 Premium & B",
      "tipo": "débito",
      "valor": 94.39,
      "saldo_apos": 371.01
    },
    {
      "data": "2025-06-02",
      "descricao": "Pago para AppFolio, Inc. F",
      "tipo": "débito",
      "valor": 2.49,
      "saldo_apos": 465.4
    },
    {
      "data": "2025-06-02",
      "descricao": "Pago para De Paula Realty",
      "tipo": "débito",
      "valor": 493.33,
      "saldo_apos": 467.89
    },
    {
      "data": "2025-06-26",
      "descricao": "Dinheiro adicionado à conta",
      "tipo": "crédito",
      "valor": 4000.0,
      "saldo_apos": 4371.01
    },
    {
      "data": "2025-06-27",
      "descricao": "Dinheiro adicionado à conta",
      "tipo": "crédito",
      "valor": 8400.0,
      "saldo_apos": 10836.38
    },
    {
      "data": "2025-06-27",
      "descricao": "Pago para AppFolio, Inc. F",
      "tipo": "débito",
      "valor": 2.49,
      "saldo_apos": 2436.38
    },
    {
      "data": "2025-06-27",
      "descricao": "Pago para De Paula Realty",
      "tipo": "débito",
      "valor": 1932.14,
      "saldo_apos": 2438.87
    },
    {
      "data": "2025-07-02",
      "descricao": "Pago para IU65 Premium & B",
      "tipo": "débito",
      "valor": 94.39,
      "saldo_apos": 10741.99
    },
    {
      "data": "2025-07-29",
      "descricao": "Recebeu dinheiro de Douglas Camargo De Campos",
      "tipo": "crédito",
      "valor": 121.0,
      "saldo_apos": 8870.28
    },
    {
      "data": "2025-07-29",
      "descricao": "Pago para AppFolio, Inc. F",
      "tipo": "débito",
      "valor": 2.49,
      "saldo_apos": 8749.28
    },
    {
      "data": "2025-07-29",
      "descricao": "Pago para De Paula Realty",
      "tipo": "débito",
      "valor": 1990.22,
      "saldo_apos": 8751.77
    },
    {
      "data": "2025-08-04",
      "descricao": "Pago para IU65 Premium & B",
      "tipo": "débito",
      "valor": 16.12,
      "saldo_apos": 8854.16
    },
    {
      "data": "2025-09-02",
      "descricao": "Pago para IU65 Premium & B",
      "tipo": "débito",
      "valor": 121.42,
      "saldo_apos": 8732.74
    },
    {
      "data": "2025-09-03",
      "descricao": "Pago para AppFolio, Inc. F",
      "tipo": "débito",
      "valor": 2.49,
      "saldo_apos": 6880.25
    },
    {
      "data": "2025-09-03",
      "descricao": "Pago para De Paula Realty",
      "tipo": "débito",
      "valor": 1850.0,
      "saldo_apos": 6882.74
    },
    {
      "data": "2025-09-23",
      "descricao": "Pago para AppFolio, Inc. F",
      "tipo": "débito",
      "valor": 2.49,
      "saldo_apos": 4879.72
    },
    {
      "data": "2025-09-23",
      "descricao": "Pago para De Paula Realty",
      "tipo": "débito",
      "valor": 1998.04,
      "saldo_apos": 4882.21
    },
    {
      "data": "2025-09-25",
      "descricao": "Pago para AppFolio, Inc. F",
      "tipo": "débito",
      "valor": 2.49,
      "saldo_apos": 4701.94
    },
    {
      "data": "2025-09-25",
      "descricao": "Pago para De Paula Realty",
      "tipo": "débito",
      "valor": 175.29,
      "saldo_apos": 4704.43
    },
    {
      "data": "2025-10-02",
      "descricao": "Pago para IU65 Premium & B",
      "tipo": "débito",
      "valor": 121.42,
      "saldo_apos": 4580.52
    },
    {
      "data": "2025-10-15",
      "descricao": "Recebeu dinheiro de IU65 Premium & B",
      "tipo": "crédito",
      "valor": 121.42,
      "saldo_apos": 4701.94
    },
    {
      "data": "2025-10-18",
      "descricao": "Recebeu dinheiro de Douglas Camargo De Campos",
      "tipo": "crédito",
      "valor": 20.0,
      "saldo_apos": 4721.94
    }
  ]
}